<?xml version="1.0" encoding="UTF-8"?>
<xs:schema 
	xmlns:xs="http://www.w3.org/2001/XMLSchema"
	xmlns="http://www.benqczyo.com/xml/Schema"
	targetNamespace="http://www.benqczyo.com/xml/Schema"
	elementFormDefault="qualified" 
	attributeFormDefault="unqualified"
>

	<xs:element name="user">
		<xs:complexType>
			<xs:sequence>
				<xs:element name="uid" type="xs:string"/>
				<xs:element name="name" type="xs:string"/>
				<xs:element name="password" type="xs:string"/>
				<xs:element name="email" type="xs:string"/>
				<xs:element name="address" type="xs:string"/>
			</xs:sequence>
		</xs:complexType>
	</xs:element>
	
	<xs:element name="userdb">
		<xs:complexType>
			<xs:sequence>
				<xs:element ref="user" maxOccurs="unbounded"/>
			</xs:sequence>
		</xs:complexType>
	</xs:element>
	
</xs:schema>
