<?xml version="1.0" encoding="UTF-8" standalone="no"?><userdb xmlns="http://www.benqczyo.com/xml/Schema" xmlns:xsi="http://www.w3.org/2001/XMLSchema-instance" xsi:schemaLocation="http://www.benqczyo.com/xml/Schema user.xsd">
	<user>
		<uid>10001</uid>
		<name>benjamin</name>
		<password>sorry</password>
		<email>test@benqczyo.com</email>
		<address>abcdeft</address>

		
	<nickname>ben</nickname><nickname>ben</nickname></user>

	<user>
		<uid>10002</uid>
		<name>jack</name>
		<password>sorry</password>
		<email>test@benqczyo.com</email>
		<address>abcdefg</address>
	</user>

</userdb>